{
  "created_at": "2026-09-07T15:42:12+09:00",
  "device_id": "wc-phone-01",
  "job_id": "8b18f63f-6ca2-4b84-b5d8-8c3d85cfa2b1",
  "mode": "proposal",
  "parameters": {},
  "pipeline_kind": "triage",
  "route_id": "codex_chatgpt_login",
  "schema_version": 1,
  "source": {
    "blob_sha256": "aaaaaaaaaaaaaaaaaaaaaaaaaaaaaaaaaaaaaaaaaaaaaaaaaaaaaaaaaaaaaaaa",
    "fragment_sha256": "cccccccccccccccccccccccccccccccccccccccccccccccccccccccccccccccc",
    "locator": "#^raw-1",
    "path": "00_Inbox/Captures/2026/09/example.md"
  },
  "target": null
}
